[
  {
    "schema_version": "3.2.0",
    "event_id": "event_2026-04-28_00000001",
    "stream_id": "stream_prop_b3f1a2c4",
    "sequence": 1,
    "previous_event_hash": null,
    "event_hash": "sha256:19d79379c6011574ed3f6434ae5749fd26a6b3cc500e94ac616f2607cd846a3a",
    "event_type": "proposal.received",
    "occurred_at": "2026-04-28T09:14:23Z",
    "recorded_at": "2026-04-28T09:14:24Z",
    "tenant": "acme-corp",
    "proposal_id": "prop_2026-04-28_b3f1a2c4",
    "actor": {
      "kind": "system",
      "identifier": "proposal-ingress",
      "authentication": {
        "method": "service_identity",
        "human_present": false,
        "assurance": "high",
        "authenticated_at": "2026-04-28T09:14:24Z"
      }
    },
    "classification": "confidential",
    "retention": {
      "class": "standard",
      "delete_after": "2027-04-28T09:14:24Z",
      "legal_hold": false
    },
    "references": {},
    "detail": {
      "action_hash": "sha256:6a8d174edc86338a3bd12c8ad6ebc301ba1135c36deb187317dde605a749bc80"
    }
  },
  {
    "schema_version": "3.2.0",
    "event_id": "event_2026-04-28_00000002",
    "stream_id": "stream_prop_b3f1a2c4",
    "sequence": 2,
    "previous_event_hash": "sha256:19d79379c6011574ed3f6434ae5749fd26a6b3cc500e94ac616f2607cd846a3a",
    "event_hash": "sha256:0a67f6689eb9c49db16bd374a11abeedbedb4dda9d60289c8c98712e395278a7",
    "event_type": "validation.passed",
    "occurred_at": "2026-04-28T09:14:24Z",
    "recorded_at": "2026-04-28T09:14:24Z",
    "tenant": "acme-corp",
    "proposal_id": "prop_2026-04-28_b3f1a2c4",
    "actor": {
      "kind": "system",
      "identifier": "approval-validator",
      "authentication": {
        "method": "service_identity",
        "human_present": false,
        "assurance": "high",
        "authenticated_at": "2026-04-28T09:14:24Z"
      }
    },
    "classification": "confidential",
    "retention": {
      "class": "standard",
      "delete_after": "2027-04-28T09:14:24Z",
      "legal_hold": false
    },
    "references": {
      "validation_id": "validation_2026-04-28_841ac000"
    },
    "detail": {
      "action_hash": "sha256:6a8d174edc86338a3bd12c8ad6ebc301ba1135c36deb187317dde605a749bc80"
    }
  },
  {
    "schema_version": "3.2.0",
    "event_id": "event_2026-04-28_00000003",
    "stream_id": "stream_prop_b3f1a2c4",
    "sequence": 3,
    "previous_event_hash": "sha256:0a67f6689eb9c49db16bd374a11abeedbedb4dda9d60289c8c98712e395278a7",
    "event_hash": "sha256:601b37e8f8c1b1574e23c3c007ac6d2f093e0b3438cc0a527a6e5b10ea2fe1b7",
    "event_type": "approval.requested",
    "occurred_at": "2026-04-28T09:14:25Z",
    "recorded_at": "2026-04-28T09:14:25Z",
    "tenant": "acme-corp",
    "proposal_id": "prop_2026-04-28_b3f1a2c4",
    "actor": {
      "kind": "system",
      "identifier": "approval-router",
      "authentication": {
        "method": "service_identity",
        "human_present": false,
        "assurance": "high",
        "authenticated_at": "2026-04-28T09:14:25Z"
      }
    },
    "classification": "confidential",
    "retention": {
      "class": "standard",
      "delete_after": "2027-04-28T09:14:25Z",
      "legal_hold": false
    },
    "references": {
      "request_id": "req_2026-04-28_6a2d8800",
      "validation_id": "validation_2026-04-28_841ac000",
      "policy_evaluation_id": "eval_2026-04-28_1c4f8a00"
    },
    "detail": {
      "action_hash": "sha256:6a8d174edc86338a3bd12c8ad6ebc301ba1135c36deb187317dde605a749bc80",
      "policy_revision": "2026-04-15.3"
    }
  },
  {
    "schema_version": "3.2.0",
    "event_id": "event_2026-04-28_00000004",
    "stream_id": "stream_prop_b3f1a2c4",
    "sequence": 4,
    "previous_event_hash": "sha256:601b37e8f8c1b1574e23c3c007ac6d2f093e0b3438cc0a527a6e5b10ea2fe1b7",
    "event_hash": "sha256:ed16c78711296aa1cfc5019d6ec7f854a45ce9c21d9f9d57e99ddb04a3d778eb",
    "event_type": "review.presented",
    "occurred_at": "2026-04-28T09:14:26Z",
    "recorded_at": "2026-04-28T09:14:26Z",
    "tenant": "acme-corp",
    "proposal_id": "prop_2026-04-28_b3f1a2c4",
    "actor": {
      "kind": "system",
      "identifier": "approval-email-renderer",
      "authentication": {
        "method": "service_identity",
        "human_present": false,
        "assurance": "high",
        "authenticated_at": "2026-04-28T09:14:26Z"
      }
    },
    "classification": "confidential",
    "retention": {
      "class": "standard",
      "delete_after": "2027-04-28T09:14:26Z",
      "legal_hold": false
    },
    "references": {
      "request_id": "req_2026-04-28_6a2d8800",
      "review_snapshot_id": "review_2026-04-28_47b2c000"
    },
    "detail": {
      "action_hash": "sha256:6a8d174edc86338a3bd12c8ad6ebc301ba1135c36deb187317dde605a749bc80",
      "payload_hash": "sha256:c919182dcf3aa49d95f5927636aeb7a6a227fa9f9b3daa7384ac4c531a9f891b",
      "review_content_hash": "sha256:1496a0bf99cb54f169a7deb5e57ec48be882f1859fbd39cc2014563d3a250636"
    }
  },
  {
    "schema_version": "3.2.0",
    "event_id": "event_2026-04-28_00000005",
    "stream_id": "stream_prop_b3f1a2c4",
    "sequence": 5,
    "previous_event_hash": "sha256:ed16c78711296aa1cfc5019d6ec7f854a45ce9c21d9f9d57e99ddb04a3d778eb",
    "event_hash": "sha256:75437b0727f1a759360ed3fcf86c1c709522c5876a080df908ba9347f61f97d7",
    "event_type": "approval.decided",
    "occurred_at": "2026-04-28T09:14:30Z",
    "recorded_at": "2026-04-28T09:14:31Z",
    "tenant": "acme-corp",
    "proposal_id": "prop_2026-04-28_b3f1a2c4",
    "actor": {
      "kind": "human",
      "identifier": "rene@acme-corp.example",
      "roles": [
        "customer-support"
      ],
      "authentication": {
        "method": "signed_callback",
        "human_present": true,
        "assurance": "substantial",
        "authenticated_at": "2026-04-28T09:14:30Z"
      }
    },
    "classification": "confidential",
    "retention": {
      "class": "standard",
      "delete_after": "2027-04-28T09:14:31Z",
      "legal_hold": false
    },
    "references": {
      "request_id": "req_2026-04-28_6a2d8800",
      "approval_id": "approval_2026-04-28_f9821000",
      "policy_evaluation_id": "eval_2026-04-28_1c4f8a00"
    },
    "detail": {
      "decision": "approved",
      "channel": "email",
      "action_hash": "sha256:6a8d174edc86338a3bd12c8ad6ebc301ba1135c36deb187317dde605a749bc80",
      "payload_hash": "sha256:c919182dcf3aa49d95f5927636aeb7a6a227fa9f9b3daa7384ac4c531a9f891b",
      "policy_revision": "2026-04-15.3",
      "wait_ms": 7000
    }
  },
  {
    "schema_version": "3.2.0",
    "event_id": "event_2026-04-28_00000006",
    "stream_id": "stream_prop_b3f1a2c4",
    "sequence": 6,
    "previous_event_hash": "sha256:75437b0727f1a759360ed3fcf86c1c709522c5876a080df908ba9347f61f97d7",
    "event_hash": "sha256:b632f86928e1de2ac10a912b1ad76a2e47444df8ebf04a24131e6e4d4e75da2a",
    "event_type": "resolution.emitted",
    "occurred_at": "2026-04-28T09:14:32Z",
    "recorded_at": "2026-04-28T09:14:32Z",
    "tenant": "acme-corp",
    "proposal_id": "prop_2026-04-28_b3f1a2c4",
    "actor": {
      "kind": "system",
      "identifier": "approval-router",
      "authentication": {
        "method": "service_identity",
        "human_present": false,
        "assurance": "high",
        "authenticated_at": "2026-04-28T09:14:32Z"
      }
    },
    "classification": "confidential",
    "retention": {
      "class": "standard",
      "delete_after": "2027-04-28T09:14:32Z",
      "legal_hold": false
    },
    "references": {
      "request_id": "req_2026-04-28_6a2d8800",
      "approval_id": "approval_2026-04-28_f9821000",
      "resolution_id": "resolution_2026-04-28_78ac1000"
    },
    "detail": {
      "decision": "approved",
      "action_hash": "sha256:6a8d174edc86338a3bd12c8ad6ebc301ba1135c36deb187317dde605a749bc80"
    }
  },
  {
    "schema_version": "3.2.0",
    "event_id": "event_2026-04-28_00000007",
    "stream_id": "stream_prop_b3f1a2c4",
    "sequence": 7,
    "previous_event_hash": "sha256:b632f86928e1de2ac10a912b1ad76a2e47444df8ebf04a24131e6e4d4e75da2a",
    "event_hash": "sha256:cf092432d3edc3711e70bea99c873964f04a6ca6700f41d2fb6d5bef34bdb021",
    "event_type": "authority.checked",
    "occurred_at": "2026-04-28T09:14:33Z",
    "recorded_at": "2026-04-28T09:14:33Z",
    "tenant": "acme-corp",
    "proposal_id": "prop_2026-04-28_b3f1a2c4",
    "actor": {
      "kind": "system",
      "identifier": "approval-gate",
      "authentication": {
        "method": "service_identity",
        "human_present": false,
        "assurance": "high",
        "authenticated_at": "2026-04-28T09:14:33Z"
      }
    },
    "classification": "confidential",
    "retention": {
      "class": "standard",
      "delete_after": "2027-04-28T09:14:33Z",
      "legal_hold": false
    },
    "references": {
      "request_id": "req_2026-04-28_6a2d8800",
      "approval_id": "approval_2026-04-28_f9821000",
      "authority_snapshot_id": "authority_2026-04-28_9bc31000"
    },
    "detail": {
      "action_hash": "sha256:6a8d174edc86338a3bd12c8ad6ebc301ba1135c36deb187317dde605a749bc80"
    }
  },
  {
    "schema_version": "3.2.0",
    "event_id": "event_2026-04-28_00000008",
    "stream_id": "stream_prop_b3f1a2c4",
    "sequence": 8,
    "previous_event_hash": "sha256:cf092432d3edc3711e70bea99c873964f04a6ca6700f41d2fb6d5bef34bdb021",
    "event_hash": "sha256:013e893a29b94d3ec759df50a2a7ceee71b7e4cda4b8af2877a524e84a543d2c",
    "event_type": "dispatch.succeeded",
    "occurred_at": "2026-04-28T09:14:34Z",
    "recorded_at": "2026-04-28T09:14:34Z",
    "tenant": "acme-corp",
    "proposal_id": "prop_2026-04-28_b3f1a2c4",
    "actor": {
      "kind": "system",
      "identifier": "email-dispatcher",
      "authentication": {
        "method": "service_identity",
        "human_present": false,
        "assurance": "high",
        "authenticated_at": "2026-04-28T09:14:33Z"
      }
    },
    "classification": "confidential",
    "retention": {
      "class": "standard",